code,type,name,group,market
030002,上市認購(售)權證,華新科元大84購30,,上市
030003,上市認購(售)權證,華新科元大84購31,,上市
030004,上市認購(售)權證,宏盛元大84購02,,上市
030005,上市認購(售)權證,高鐵元大84購03,,上市
030006,上市認購(售)權證,新光金元大85購02,,上市
030007,上市認購(售)權證,永豐金元大84購01,,上市
030008,上市認購(售)權證,隆達元大84購01,,上市
030009,上市認購(售)權證,麗豐元大85購02,,上市
030010,上市認購(售)權證,宏達電統一86購01,,上市
030011,上市認購(售)權證,中石化元富84購02,,上市
030012,上市認購(售)權證,儒鴻元富84購01,,上市
030013,上市認購(售)權證,和大元富84購01,,上市
030014,上市認購(售)權證,東聯元富84購02,,上市
030015,上市認購(售)權證,京元電元富84購01,,上市
030016,上市認購(售)權證,奇力新元富84購02,,上市
030017,上市認購(售)權證,可成元富84購04,,上市
030018,上市認購(售)權證,可成元富84購05,,上市
030019,上市認購(售)權證,日電貿元富84購02,,上市
03001P,上市認購(售)權證,玉晶光兆豐83售03,,上市
03001X,上市認購(售)權證,元展01,,上市
030020,上市認購(售)權證,臺股指元富84購05,,上市
030021,上市認購(售)權證,臺股指元富84購06,,上市
030022,上市認購(售)權證,臺股指元富84購07,,上市
030023,上市認購(售)權證,臺股指元富84購08,,上市
030024,上市認購(售)權證,上銀國泰84購01,,上市
030025,上市認購(售)權證,晶電永昌85購01,,上市
030026,上市認購(售)權證,全新永昌84購01,,上市
030027,上市認購(售)權證,創意永昌84購01,,上市
030028,上市認購(售)權證,榮成富邦85購01,,上市
030029,上市認購(售)權證,為升富邦85購01,,上市
030030,上市認購(售)權證,晶電富邦85購01,,上市
030031,上市認購(售)權證,奇力新富邦86購01,,上市
030032,上市認購(售)權證,創意富邦85購01,,上市
030033,上市認購(售)權證,群創富邦85購01,,上市
030034,上市認購(售)權證,臻鼎富邦84購01,,上市
030035,上市認購(售)權證,元油反凱基87購01,,上市
030036,上市認購(售)權證,力麗凱基84購01,,上市
030037,上市認購(售)權證,華新凱基84購01,,上市
030038,上市認購(售)權證,聯電凱基84購03,,上市
030039,上市認購(售)權證,大同凱基85購04,,上市
030040,上市認購(售)權證,晶電凱基87購01,,上市
030041,上市認購(售)權證,奇力新凱基84購03,,上市
030042,上市認購(售)權證,奇力新凱基84購04,,上市
030043,上市認購(售)權證,奇力新凱基84購05,,上市
030044,上市認購(售)權證,台航凱基84購04,,上市
030045,上市認購(售)權證,台航凱基84購05,,上市
030046,上市認購(售)權證,台新金凱基84購01,,上市
030047,上市認購(售)權證,聯鈞凱基84購01,,上市
030048,上市認購(售)權證,上緯控凱基84購05,,上市
030049,上市認購(售)權證,麗豐凱基84購05,,上市
03004P,上市認購(售)權證,華新科國泰84售02,,上市
03004X,上市認購(售)權證,元展04,,上市
030050,上市認購(售)權證,和碩凱基84購03,,上市
030051,上市認購(售)權證,達運凱基84購01,,上市
030052,上市認購(售)權證,達方凱基84購03,,上市
030053,上市認購(售)權證,臺股指凱基84購09,,上市
030054,上市認購(售)權證,臺股指凱基84購10,,上市
030055,上市認購(售)權證,臺股指凱基84購11,,上市
030056,上市認購(售)權證,臺股指凱基84購12,,上市
030057,上市認購(售)權證,臺股指凱基84購13,,上市
030058,上市認購(售)權證,臺股指凱基84購14,,上市
030059,上市認購(售)權證,臺股指凱基84購15,,上市
03005X,上市認購(售)權證,元展05,,上市
030060,上市認購(售)權證,台勝科第一84購01,,上市
030061,上市認購(售)權證,麗豐第一84購01,,上市
030062,上市認購(售)權證,祥碩第一84購01,,上市
030063,上市認購(售)權證,T50反1中信86購02,,上市
030064,上市認購(售)權證,台積電中信84購03,,上市
030065,上市認購(售)權證,台積電中信84購04,,上市
030066,上市認購(售)權證,台積電中信84購05,,上市
030067,上市認購(售)權證,台積電中信84購06,,上市
030068,上市認購(售)權證,臺股指中信84購06,,上市
030069,上市認購(售)權證,台灣50群益84購03,,上市
03006X,上市認購(售)權證,元展06,,上市
030070,上市認購(售)權證,T50正2群益84購01,,上市
030071,上市認購(售)權證,台積電群益84購13,,上市
030072,上市認購(售)權證,台積電群益84購14,,上市
030073,上市認購(售)權證,盟立群益84購01,,上市
030074,上市認購(售)權證,可成群益84購06,,上市
030075,上市認購(售)權證,華新科群益84購12,,上市
030076,上市認購(售)權證,華新科群益85購01,,上市
030077,上市認購(售)權證,宏達電群益84購02,,上市
030078,上市認購(售)權證,新興群益84購02,,上市
030079,上市認購(售)權證,玉山金群益84購01,,上市
03007X,上市認購(售)權證,元展07,,上市
030080,上市認購(售)權證,玉晶光群益86購02,,上市
030081,上市認購(售)權證,台勝科群益84購06,,上市
030082,上市認購(售)權證,康普群益84購01,,上市
030083,上市認購(售)權證,台郡群益84購05,,上市
030084,上市認購(售)權證,康友群益84購04,,上市
030085,上市認購(售)權證,國巨兆豐85購03,,上市
030086,上市認購(售)權證,華邦電兆豐84購02,,上市
030087,上市認購(售)權證,可成兆豐85購03,,上市
030088,上市認購(售)權證,華新科兆豐85購04,,上市
030089,上市認購(售)權證,貿聯兆豐85購01,,上市
03008P,上市認購(售)權證,華新科統一84售04,,上市
030090,上市認購(售)權證,日月光兆豐84購01,,上市
030091,上市認購(售)權證,祥碩兆豐84購01,,上市
030092,上市認購(售)權證,統一麥證84購01,,上市
030093,上市認購(售)權證,統一麥證85購01,,上市
030094,上市認購(售)權證,統一麥證85購02,,上市
030095,上市認購(售)權證,南亞麥證84購03,,上市
030096,上市認購(售)權證,南亞麥證85購01,,上市
030097,上市認購(售)權證,南亞麥證85購02,,上市
030098,上市認購(售)權證,遠東新麥證84購02,,上市
030099,上市認購(售)權證,遠東新麥證84購03,,上市
03009X,上市認購(售)權證,元展09,,上市
030100,上市認購(售)權證,遠東新麥證85購01,,上市
030101,上市認購(售)權證,遠東新麥證85購02,,上市
030102,上市認購(售)權證,中鋼麥證84購02,,上市
030103,上市認購(售)權證,台積電麥證84購02,,上市
030104,上市認購(售)權證,台積電麥證84購03,,上市
030105,上市認購(售)權證,台積電麥證85購02,,上市
030106,上市認購(售)權證,台積電麥證85購03,,上市
030107,上市認購(售)權證,臺企銀麥證84購01,,上市
030108,上市認購(售)權證,臺企銀麥證85購01,,上市
030109,上市認購(售)權證,富邦金麥證84購01,,上市
03010X,上市認購(售)權證,元展10,,上市
030110,上市認購(售)權證,富邦金麥證84購02,,上市
030111,上市認購(售)權證,台新金麥證84購02,,上市
030112,上市認購(售)權證,台新金麥證85購01,,上市
030113,上市認購(售)權證,和碩麥證84購03,,上市
030114,上市認購(售)權證,和碩麥證85購01,,上市
030115,上市認購(售)權證,和碩麥證85購02,,上市
030116,上市認購(售)權證,台灣50國票84購03,,上市
030117,上市認購(售)權證,大成鋼國票84購02,,上市
030118,上市認購(售)權證,國巨國票84購10,,上市
030119,上市認購(售)權證,國巨國票84購11,,上市
030120,上市認購(售)權證,台積電國票84購05,,上市
030121,上市認購(售)權證,台積電國票84購06,,上市
030122,上市認購(售)權證,燿華國票84購02,,上市
030123,上市認購(售)權證,華新科國票84購05,,上市
030124,上市認購(售)權證,台灣50凱基86購04,,上市
030125,上市認購(售)權證,S&P500凱基84購02,,上市
030126,上市認購(售)權證,S&P反1凱基84購01,,上市
030127,上市認購(售)權證,力山凱基85購01,,上市
030128,上市認購(售)權證,華新凱基84購02,,上市
030129,上市認購(售)權證,榮成凱基84購01,,上市
03012X,上市認購(售)權證,元展12,,上市
030130,上市認購(售)權證,廣宇凱基84購02,,上市
030131,上市認購(售)權證,台積電凱基84購20,,上市
030132,上市認購(售)權證,光磊凱基84購01,,上市
030133,上市認購(售)權證,南亞科凱基84購02,,上市
030134,上市認購(售)權證,盟立凱基84購01,,上市
030135,上市認購(售)權證,可成凱基84購14,,上市
030136,上市認購(售)權證,強茂凱基84購01,,上市
030137,上市認購(售)權證,智原凱基84購06,,上市
030138,上市認購(售)權證,京鼎凱基84購02,,上市
030139,上市認購(售)權證,台郡凱基84購02,,上市
03013X,上市認購(售)權證,元展13,,上市
030140,上市認購(售)權證,GIS凱基84購07,,上市
030141,上市認購(售)權證,達方凱基84購04,,上市
030142,上市認購(售)權證,T50反1元大84購06,,上市
030143,上市認購(售)權證,T50反1元大84購07,,上市
030144,上市認購(售)權證,國喬元大84購01,,上市
030145,上市認購(售)權證,遠東新元大84購03,,上市
030146,上市認購(售)權證,遠東新元大84購04,,上市
030147,上市認購(售)權證,力山元大84購03,,上市
030148,上市認購(售)權證,國巨元大84購23,,上市
030149,上市認購(售)權證,台積電元大84購19,,上市
03014X,上市認購(售)權證,元展14,,上市
030150,上市認購(售)權證,台積電元大84購20,,上市
030151,上市認購(售)權證,台積電元大84購21,,上市
030152,上市認購(售)權證,台積電元大84購22,,上市
030153,上市認購(售)權證,台積電元大84購23,,上市
030154,上市認購(售)權證,台積電元大84購24,,上市
030155,上市認購(售)權證,台積電元大84購25,,上市
030156,上市認購(售)權證,台積電元大84購26,,上市
030157,上市認購(售)權證,華邦電元大84購08,,上市
030158,上市認購(售)權證,英業達元大84購01,,上市
030159,上市認購(售)權證,技嘉元大84購01,,上市
03015X,上市認購(售)權證,元展15,,上市
030160,上市認購(售)權證,晶電元大85購03,,上市
030161,上市認購(售)權證,聯發科元大84購11,,上市
030162,上市認購(售)權證,華新科元大84購32,,上市
030163,上市認購(售)權證,新日興元大84購01,,上市
030164,上市認購(售)權證,日月光元大84購04,,上市
030165,上市認購(售)權證,日月光元大84購06,,上市
030166,上市認購(售)權證,瀚宇博元大84購02,,上市
030167,上市認購(售)權證,臺股指元大84購48,,上市
030168,上市認購(售)權證,臺股指元大84購49,,上市
030169,上市認購(售)權證,臺股指元大84購50,,上市
03016X,上市認購(售)權證,元展16,,上市
030170,上市認購(售)權證,T50反1統一87購01,,上市
030171,上市認購(售)權證,華通統一86購01,,上市
030172,上市認購(售)權證,台積電統一88購04,,上市
030173,上市認購(售)權證,旺宏統一87購02,,上市
030174,上市認購(售)權證,致茂統一87購01,,上市
030175,上市認購(售)權證,南亞科統一87購01,,上市
030176,上市認購(售)權證,華新科統一86購05,,上市
030177,上市認購(售)權證,冠德統一87購02,,上市
030178,上市認購(售)權證,興富發統一86購02,,上市
030179,上市認購(售)權證,和碩統一86購01,,上市
03017X,上市認購(售)權證,元展17,,上市
030180,上市認購(售)權證,宏碁元富84購02,,上市
030181,上市認購(售)權證,南亞科元富84購02,,上市
030182,上市認購(售)權證,日月光元富84購03,,上市
030183,上市認購(售)權證,旺宏永豐84購08,,上市
030184,上市認購(售)權證,宏碁永豐84購01,,上市
030185,上市認購(售)權證,台光電永豐84購01,,上市
030186,上市認購(售)權證,奇力新永豐84購01,,上市
030187,上市認購(售)權證,宏達電永豐84購02,,上市
030188,上市認購(售)權證,明泰永豐84購01,,上市
030189,上市認購(售)權證,台勝科永豐84購02,,上市
030190,上市認購(售)權證,嘉澤永豐84購03,,上市
030191,上市認購(售)權證,正文永豐84購01,,上市
030192,上市認購(售)權證,GIS永豐84購02,,上市
030193,上市認購(售)權證,滬深2X國泰84購02,,上市
030194,上市認購(售)權證,嘉聯益國泰84購02,,上市
030195,上市認購(售)權證,和大永昌84購01,,上市
030196,上市認購(售)權證,聯電永昌84購02,,上市
030197,上市認購(售)權證,致茂永昌85購01,,上市
030198,上市認購(售)權證,聯發科永昌84購01,,上市
030199,上市認購(售)權證,可成永昌84購01,,上市
03019X,上市認購(售)權證,元展19,,上市
030200,上市認購(售)權證,華新科永昌84購03,,上市
030201,上市認購(售)權證,新光金永昌84購01,,上市
030202,上市認購(售)權證,聯詠永昌84購03,,上市
030203,上市認購(售)權證,台勝科永昌84購02,,上市
030204,上市認購(售)權證,祥碩永昌84購01,,上市
030205,上市認購(售)權證,台灣50富邦84購01,,上市
030206,上市認購(售)權證,為升第一84購01,,上市
030207,上市認購(售)權證,南亞科國票84購02,,上市
030208,上市認購(售)權證,晶電國票85購01,,上市
030209,上市認購(售)權證,奇力新國票84購02,,上市
03020P,上市認購(售)權證,華新科凱基83售09,,上市
03020X,上市認購(售)權證,元展20,,上市
030210,上市認購(售)權證,大立光國票84購07,,上市
030211,上市認購(售)權證,力山中信85購01,,上市
030212,上市認購(售)權證,國巨中信86購01,,上市
030213,上市認購(售)權證,華新科中信86購01,,上市
030214,上市認購(售)權證,冠德中信84購01,,上市
030215,上市認購(售)權證,國泰金中信84購01,,上市
030216,上市認購(售)權證,大立光中信85購04,,上市
030217,上市認購(售)權證,大立光中信86購03,,上市
030218,上市認購(售)權證,祥碩中信84購02,,上市
030219,上市認購(售)權證,台灣50兆豐85購01,,上市
03021P,上市認購(售)權證,華新科凱基83售10,,上市
03021X,上市認購(售)權證,元展21,,上市
030220,上市認購(售)權證,宏碁兆豐84購02,,上市
030221,上市認購(售)權證,瑞昱兆豐84購02,,上市
030222,上市認購(售)權證,新光金兆豐84購01,,上市
030223,上市認購(售)權證,大立光兆豐84購07,,上市
030224,上市認購(售)權證,大立光兆豐85購03,,上市
030225,上市認購(售)權證,聯詠兆豐84購02,,上市
030226,上市認購(售)權證,群創兆豐84購01,,上市
030227,上市認購(售)權證,A50正2凱基84購01,,上市
030228,上市認購(售)權證,智邦凱基84購04,,上市
030229,上市認購(售)權證,智邦凱基84購05,,上市
03022P,上市認購(售)權證,華新科凱基83售11,,上市
03022X,上市認購(售)權證,富展01,,上市
030230,上市認購(售)權證,大同凱基85購05,,上市
030231,上市認購(售)權證,大同凱基86購01,,上市
030232,上市認購(售)權證,華新科凱基85購11,,上市
030233,上市認購(售)權證,華新科凱基85購12,,上市
030234,上市認購(售)權證,華新科凱基85購13,,上市
030235,上市認購(售)權證,東森凱基84購02,,上市
030236,上市認購(售)權證,大立光凱基84購20,,上市
030237,上市認購(售)權證,大立光凱基84購21,,上市
030238,上市認購(售)權證,華晶科凱基84購01,,上市
030239,上市認購(售)權證,玉晶光凱基84購08,,上市
03023X,上市認購(售)權證,富展02,,上市
030240,上市認購(售)權證,和碩凱基84購04,,上市
030241,上市認購(售)權證,祥碩凱基84購04,,上市
030242,上市認購(售)權證,嘉聯益凱基84購04,,上市
030243,上市認購(售)權證,元黃金元大85購02,,上市
030244,上市認購(售)權證,元金2X元大84購04,,上市
030245,上市認購(售)權證,亞泥元大84購01,,上市
030246,上市認購(售)權證,亞德客元大84購05,,上市
030247,上市認購(售)權證,華新元大85購01,,上市
030248,上市認購(售)權證,智邦元大84購08,,上市
030249,上市認購(售)權證,致茂元大84購06,,上市
030250,上市認購(售)權證,友達元大84購01,,上市
030251,上市認購(售)權證,友達元大84購02,,上市
030252,上市認購(售)權證,聯發科元大84購12,,上市
030253,上市認購(售)權證,可成元大84購20,,上市
030254,上市認購(售)權證,可成元大84購21,,上市
030255,上市認購(售)權證,華新科元大84購33,,上市
030256,上市認購(售)權證,新光金元大84購06,,上市
030257,上市認購(售)權證,新光金元大85購03,,上市
030258,上市認購(售)權證,聯詠元大84購08,,上市
030259,上市認購(售)權證,群創元大84購03,,上市
03025X,上市認購(售)權證,元展22,,上市
030260,上市認購(售)權證,台勝科元大85購01,,上市
030261,上市認購(售)權證,嘉聯益元大85購03,,上市
030262,上市認購(售)權證,達方元大85購02,,上市
030263,上市認購(售)權證,上証2X群益84購04,,上市
030264,上市認購(售)權證,滬深2X群益84購03,,上市
030265,上市認購(售)權證,統一群益84購01,,上市
030266,上市認購(售)權證,華新群益84購02,,上市
030267,上市認購(售)權證,上銀群益84購06,,上市
030268,上市認購(售)權證,為升群益84購02,,上市
030269,上市認購(售)權證,聯電群益84購01,,上市
03026X,上市認購(售)權證,元展23,,上市
030270,上市認購(售)權證,宏碁群益84購03,,上市
030271,上市認購(售)權證,宏碁群益84購04,,上市
030272,上市認購(售)權證,致茂群益84購03,,上市
030273,上市認購(售)權證,致茂群益84購04,,上市
030274,上市認購(售)權證,微星群益84購02,,上市
030275,上市認購(售)權證,台光電群益84購01,,上市
030276,上市認購(售)權證,南亞科群益84購03,,上市
030277,上市認購(售)權證,友達群益84購01,,上市
030278,上市認購(售)權證,可成群益84購07,,上市
030279,上市認購(售)權證,華新科群益84購14,,上市
03027X,上市認購(售)權證,元展24,,上市
030280,上市認購(售)權證,華新科群益84購15,,上市
030281,上市認購(售)權證,華新科群益84購16,,上市
030282,上市認購(售)權證,華新科群益84購17,,上市
030283,上市認購(售)權證,華新科群益84購18,,上市
030284,上市認購(售)權證,台航群益84購02,,上市
030285,上市認購(售)權證,禾伸堂群益84購05,,上市
030286,上市認購(售)權證,玉晶光群益86購03,,上市
030287,上市認購(售)權證,台勝科群益84購07,,上市
030288,上市認購(售)權證,康友群益84購05,,上市
030289,上市認購(售)權證,滬深2X統一86購01,,上市
03028X,上市認購(售)權證,元展25,,上市
030290,上市認購(售)權證,國巨統一87購03,,上市
030291,上市認購(售)權證,美律統一87購01,,上市
030292,上市認購(售)權證,大立光統一86購06,,上市
030293,上市認購(售)權證,日月光統一87購02,,上市
030294,上市認購(售)權證,日月光統一87購03,,上市
030295,上市認購(售)權證,嘉聯益統一86購02,,上市
030296,上市認購(售)權證,大立光元富84購08,,上市
030297,上市認購(售)權證,大立光元富84購09,,上市
030298,上市認購(售)權證,上銀永豐84購03,,上市
030299,上市認購(售)權證,光磊永豐84購02,,上市
03029X,上市認購(售)權證,元展26,,上市
030300,上市認購(售)權證,美律永豐84購03,,上市
030301,上市認購(售)權證,嘉晶永豐84購01,,上市
030302,上市認購(售)權證,京鼎永豐84購01,,上市
030303,上市認購(售)權證,健策永豐84購02,,上市
030304,上市認購(售)權證,隆達永豐84購01,,上市
030305,上市認購(售)權證,祥碩永豐84購03,,上市
030306,上市認購(售)權證,同欣電永豐84購02,,上市
030307,上市認購(售)權證,易華電永豐84購02,,上市
030308,上市認購(售)權證,大立光台新85購01,,上市
030309,上市認購(售)權證,深中小富邦85購02,,上市
030310,上市認購(售)權證,元油反富邦87購01,,上市
030311,上市認購(售)權證,南亞富邦84購01,,上市
030312,上市認購(售)權證,可成第一84購01,,上市
030313,上市認購(售)權證,台灣50中信87購01,,上市
030314,上市認購(售)權證,上証2X中信86購02,,上市
030315,上市認購(售)權證,新光鋼中信86購02,,上市
030316,上市認購(售)權證,大同中信8A購01,,上市
030317,上市認購(售)權證,聯發科中信86購01,,上市
030318,上市認購(售)權證,台郡兆豐85購01,,上市
030319,上市認購(售)權證,國巨國票84購12,,上市
030320,上市認購(售)權證,台積電國票84購07,,上市
030321,上市認購(售)權證,智邦國票84購01,,上市
030322,上市認購(售)權證,上証2X元大84購03,,上市
030323,上市認購(售)權證,上証2X元大84購04,,上市
030324,上市認購(售)權證,滬深2X元大84購10,,上市
030325,上市認購(售)權證,滬深2X元大84購11,,上市
030326,上市認購(售)權證,滬深2X元大84購12,,上市
030327,上市認購(售)權證,華夏元大85購01,,上市
030328,上市認購(售)權證,大成鋼元大84購11,,上市
030329,上市認購(售)權證,大成鋼元大84購12,,上市
03032X,上市認購(售)權證,元展29,,上市
030330,上市認購(售)權證,旺宏元大86購01,,上市
030331,上市認購(售)權證,燿華元大86購01,,上市
030332,上市認購(售)權證,大同元大84購10,,上市
030333,上市認購(售)權證,南亞科元大84購06,,上市
030334,上市認購(售)權證,南亞科元大84購07,,上市
030335,上市認購(售)權證,南亞科元大84購08,,上市
030336,上市認購(售)權證,全新元大85購01,,上市
030337,上市認購(售)權證,可成元大84購22,,上市
030338,上市認購(售)權證,可成元大84購23,,上市
030339,上市認購(售)權證,華新科元大84購34,,上市
03033X,上市認購(售)權證,元展30,,上市
030340,上市認購(售)權證,玉晶光元大86購01,,上市
030341,上市認購(售)權證,嘉澤元大85購02,,上市
030342,上市認購(售)權證,臻鼎元大84購07,,上市
030343,上市認購(售)權證,同欣電元大85購02,,上市
030344,上市認購(售)權證,矽創元大85購01,,上市
030345,上市認購(售)權證,電子類元大84購02,,上市
030346,上市認購(售)權證,電子類元大84購03,,上市
030347,上市認購(售)權證,上証2X永豐84購02,,上市
030348,上市認購(售)權證,滬深2X永豐84購02,,上市
030349,上市認購(售)權證,國喬永豐84購01,,上市
030350,上市認購(售)權證,儒鴻永豐84購01,,上市
030351,上市認購(售)權證,聯電永豐84購03,,上市
030352,上市認購(售)權證,技嘉永豐84購01,,上市
030353,上市認購(售)權證,瑞昱永豐84購01,,上市
030354,上市認購(售)權證,南亞科永豐84購02,,上市
030355,上市認購(售)權證,華新科永豐84購06,,上市
030356,上市認購(售)權證,康友永豐84購04,,上市
030357,上市認購(售)權證,宏碁台新84購01,,上市
030358,上市認購(售)權證,T50反1日盛84購01,,上市
030359,上市認購(售)權證,滬深2X日盛84購02,,上市
03035X,上市認購(售)權證,元展32,,上市
030360,上市認購(售)權證,台灣50康和84購01,,上市
030361,上市認購(售)權證,上証2X元富84購01,,上市
030362,上市認購(售)權證,奇力新元富85購01,,上市
030363,上市認購(售)權證,智邦統一86購01,,上市
030364,上市認購(售)權證,大同統一87購01,,上市
030365,上市認購(售)權證,南亞科統一86購02,,上市
030366,上市認購(售)權證,台泥麥證84購03,,上市
030367,上市認購(售)權證,台泥麥證85購01,,上市
030368,上市認購(售)權證,台塑麥證85購01,,上市
030369,上市認購(售)權證,華夏麥證84購01,,上市
030370,上市認購(售)權證,國喬麥證84購02,,上市
030371,上市認購(售)權證,台化麥證84購01,,上市
030372,上市認購(售)權證,台化麥證85購01,,上市
030373,上市認購(售)權證,台化麥證85購02,,上市
030374,上市認購(售)權證,東聯麥證84購02,,上市
030375,上市認購(售)權證,榮成麥證84購02,,上市
030376,上市認購(售)權證,中鋼麥證85購02,,上市
030377,上市認購(售)權證,大成鋼麥證84購01,,上市
030378,上市認購(售)權證,為升麥證84購03,,上市
030379,上市認購(售)權證,聯電麥證84購03,,上市
030380,上市認購(售)權證,聯電麥證84購04,,上市
030381,上市認購(售)權證,仁寶麥證84購01,,上市
030382,上市認購(售)權證,瑞昱麥證84購01,,上市
030383,上市認購(售)權證,瑞昱麥證84購02,,上市
030384,上市認購(售)權證,瑞昱麥證85購01,,上市
030385,上市認購(售)權證,瑞昱麥證85購02,,上市
030386,上市認購(售)權證,宏達電麥證84購01,,上市
030387,上市認購(售)權證,智易麥證84購01,,上市
030388,上市認購(售)權證,台灣50群益84購04,,上市
030389,上市認購(售)權證,上証2X群益84購05,,上市
03038X,上市認購(售)權證,元展35,,上市
030390,上市認購(售)權證,滬深2X群益84購04,,上市
030391,上市認購(售)權證,大成鋼群益84購07,,上市
030392,上市認購(售)權證,上銀群益84購07,,上市
030393,上市認購(售)權證,國巨群益84購19,,上市
030394,上市認購(售)權證,致茂群益84購05,,上市
030395,上市認購(售)權證,大同群益84購04,,上市
030396,上市認購(售)權證,南亞科群益84購04,,上市
030397,上市認購(售)權證,南亞科群益84購05,,上市
030398,上市認購(售)權證,晶電群益84購08,,上市
030399,上市認購(售)權證,晶電群益84購09,,上市
03039P,上市認購(售)權證,南亞科富邦83售03,,上市
03039X,上市認購(售)權證,元展36,,上市
030400,上市認購(售)權證,聯發科群益84購01,,上市
030401,上市認購(售)權證,聯發科群益84購02,,上市
