code,type,name,group,market
05467P,上市認購(售)權證,臺股指麥證86售04,,上市
05468P,上市認購(售)權證,臺股指麥證86售05,,上市
05469P,上市認購(售)權證,臺股指麥證86售06,,上市
05470P,上市認購(售)權證,嘉晶元大86售02,,上市
05471P,上市認購(售)權證,可成群益86售08,,上市
05472P,上市認購(售)權證,可成群益86售09,,上市
05473P,上市認購(售)權證,可成群益87售02,,上市
05474P,上市認購(售)權證,臻鼎群益86售01,,上市
05475P,上市認購(售)權證,元油2X國票87售07,,上市
05476P,上市認購(售)權證,台郡國票87售01,,上市
05477P,上市認購(售)權證,瑞昱富邦86售01,,上市
05478P,上市認購(售)權證,上銀統一86售02,,上市
05479P,上市認購(售)權證,臺股指統一88售02,,上市
05480P,上市認購(售)權證,臺股指統一88售03,,上市
05481P,上市認購(售)權證,元油2X元富86售01,,上市
05482P,上市認購(售)權證,奇力新元富86售02,,上市
05483P,上市認購(售)權證,臺股指元富86售06,,上市
05484P,上市認購(售)權證,臺股指元富86售07,,上市
05485P,上市認購(售)權證,臺股指元富86售08,,上市
05486P,上市認購(售)權證,大同康和86售04,,上市
05487P,上市認購(售)權證,大同中信86售01,,上市
05488P,上市認購(售)權證,大同中信88售01,,上市
05489P,上市認購(售)權證,奇力新群益86售01,,上市
05490P,上市認購(售)權證,大立光群益86售01,,上市
05491P,上市認購(售)權證,麗豐群益89售01,,上市
05492P,上市認購(售)權證,康普群益89售01,,上市
05493P,上市認購(售)權證,台灣50元大86售02,,上市
05494P,上市認購(售)權證,元油2X元大86售08,,上市
05495P,上市認購(售)權證,英業達元大86售01,,上市
05496P,上市認購(售)權證,臺股指永豐86售02,,上市
05497P,上市認購(售)權證,台灣50國票87售03,,上市
05498P,上市認購(售)權證,新光鋼國票88售01,,上市
05499P,上市認購(售)權證,宏達電國票87售01,,上市
05500P,上市認購(售)權證,達方國票87售02,,上市
05501P,上市認購(售)權證,義隆統一87售01,,上市
05502P,上市認購(售)權證,元油2X元富86售02,,上市
05503P,上市認購(售)權證,元油2X康和86售03,,上市
05504P,上市認購(售)權證,宏碁富邦86售02,,上市
05505P,上市認購(售)權證,T50反1統一86售02,,上市
05506P,上市認購(售)權證,GIS統一86售01,,上市
05507P,上市認購(售)權證,智易康和87售01,,上市
05508P,上市認購(售)權證,T50反1永豐86售01,,上市
05509P,上市認購(售)權證,創意永豐86售02,,上市
05510P,上市認購(售)權證,嘉聯益永豐86售02,,上市
05511P,上市認購(售)權證,英業達中信86售02,,上市
05512P,上市認購(售)權證,聯發科中信87售01,,上市
05513P,上市認購(售)權證,英業達群益86售01,,上市
05514P,上市認購(售)權證,致茂群益86售02,,上市
05515P,上市認購(售)權證,欣興群益86售02,,上市
05516P,上市認購(售)權證,智易群益89售01,,上市
05517P,上市認購(售)權證,T50反1凱基89售01,,上市
05518P,上市認購(售)權證,T50反1凱基89售02,,上市
05519P,上市認購(售)權證,上銀元大86售05,,上市
05520P,上市認購(售)權證,旺宏國票87售01,,上市
05521P,上市認購(售)權證,國巨中信86售02,,上市
05522P,上市認購(售)權證,國巨中信88售01,,上市
05523P,上市認購(售)權證,旺宏中信88售01,,上市
05524P,上市認購(售)權證,啟碁中信86售01,,上市
05525P,上市認購(售)權證,上銀兆豐87售01,,上市
05526P,上市認購(售)權證,東聯群益86售01,,上市
05527P,上市認購(售)權證,鴻海群益86售02,,上市
05528P,上市認購(售)權證,宏碁群益86售01,,上市
05529P,上市認購(售)權證,台光電群益86售03,,上市
05530P,上市認購(售)權證,新光金群益86售01,,上市
05531P,上市認購(售)權證,華新科凱基86售11,,上市
05532P,上市認購(售)權證,華新科凱基86售12,,上市
05533P,上市認購(售)權證,華新科凱基86售13,,上市
05534P,上市認購(售)權證,儒鴻國票87售01,,上市
05535P,上市認購(售)權證,瑞昱國票86售02,,上市
05536P,上市認購(售)權證,聯發科國票86售02,,上市
05537P,上市認購(售)權證,欣興國票87售01,,上市
05538P,上市認購(售)權證,南電國票87售01,,上市
05539P,上市認購(售)權證,滬深2X富邦86售03,,上市
05540P,上市認購(售)權證,聯發科富邦88售01,,上市
05541P,上市認購(售)權證,可成富邦87售02,,上市
05542P,上市認購(售)權證,大同元大86售03,,上市
05543P,上市認購(售)權證,可成元大86售08,,上市
05544P,上市認購(售)權證,鴻海兆豐86售04,,上市
05545P,上市認購(售)權證,大成鋼凱基88售03,,上市
05546P,上市認購(售)權證,鴻海中信86售04,,上市
05547P,上市認購(售)權證,大同中信88售03,,上市
05548P,上市認購(售)權證,聯發科中信8A售02,,上市
05549P,上市認購(售)權證,可成中信87售02,,上市
05550P,上市認購(售)權證,致茂元大86售02,,上市
05551P,上市認購(售)權證,新光金元大86售02,,上市
05552P,上市認購(售)權證,元上證群益86售01,,上市
05553P,上市認購(售)權證,力山群益86售02,,上市
05554P,上市認購(售)權證,台達電群益86售01,,上市
05555P,上市認購(售)權證,英業達群益86售02,,上市
05556P,上市認購(售)權證,瑞昱群益86售02,,上市
05557P,上市認購(售)權證,義隆群益86售01,,上市
05558P,上市認購(售)權證,玉晶光群益88售01,,上市
05559P,上市認購(售)權證,揚明光群益86售02,,上市
05560P,上市認購(售)權證,亞光富邦86售02,,上市
05561P,上市認購(售)權證,美律中信86售02,,上市
05562P,上市認購(售)權證,全新永豐86售03,,上市
05563P,上市認購(售)權證,禾伸堂永豐86售02,,上市
05564P,上市認購(售)權證,英業達群益86售03,,上市
05565P,上市認購(售)權證,美律群益86售04,,上市
05566P,上市認購(售)權證,京元電群益86售02,,上市
05567P,上市認購(售)權證,宏達電群益86售04,,上市
05568P,上市認購(售)權證,大立光群益86售05,,上市
05569P,上市認購(售)權證,大立光群益86售06,,上市
05570P,上市認購(售)權證,大立光群益86售07,,上市
05571P,上市認購(售)權證,麗豐國票87售01,,上市
05572P,上市認購(售)權證,大同元大86售04,,上市
05573P,上市認購(售)權證,大同元大86售05,,上市
05574P,上市認購(售)權證,GIS元大86售03,,上市
05575P,上市認購(售)權證,金融類元大86售01,,上市
05576P,上市認購(售)權證,金融類元大86售02,,上市
05577P,上市認購(售)權證,台灣50元富88售02,,上市
05578P,上市認購(售)權證,上銀群益86售04,,上市
05579P,上市認購(售)權證,大同群益86售05,,上市
05580P,上市認購(售)權證,上銀統一86售03,,上市
05581P,上市認購(售)權證,臺股指康和86售04,,上市
05582P,上市認購(售)權證,臺股指康和86售05,,上市
05583P,上市認購(售)權證,臺股指康和86售06,,上市
05584P,上市認購(售)權證,臺股指康和86售07,,上市
05585P,上市認購(售)權證,上証2X元富86售03,,上市
05586P,上市認購(售)權證,全新元富86售01,,上市
05587P,上市認購(售)權證,奇力新永豐86售03,,上市
05588P,上市認購(售)權證,TPK永豐86售02,,上市
05589P,上市認購(售)權證,滬深2X凱基86售08,,上市
05590P,上市認購(售)權證,S&P反1凱基86售01,,上市
05591P,上市認購(售)權證,鴻海元大86售09,,上市
05592P,上市認購(售)權證,鴻海元大86售10,,上市
05593P,上市認購(售)權證,國巨元大86售06,,上市
05594P,上市認購(售)權證,國巨元大86售07,,上市
05595P,上市認購(售)權證,華邦電元大86售04,,上市
05596P,上市認購(售)權證,聯發科元大86售03,,上市
05597P,上市認購(售)權證,聯發科元大86售04,,上市
05598P,上市認購(售)權證,可成元大86售09,,上市
05599P,上市認購(售)權證,麗豐元大86售02,,上市
05600P,上市認購(售)權證,貿聯國票87售01,,上市
05601P,上市認購(售)權證,大同國泰86售06,,上市
05602P,上市認購(售)權證,大同富邦86售02,,上市
05603P,上市認購(售)權證,中鋼中信89售02,,上市
05604P,上市認購(售)權證,台灣50群益87售02,,上市
05605P,上市認購(售)權證,元油2X群益87售02,,上市
05606P,上市認購(售)權證,美律群益8A售01,,上市
05607P,上市認購(售)權證,大同凱基87售01,,上市
05608P,上市認購(售)權證,大同凱基87售02,,上市
05609P,上市認購(售)權證,大同國票87售01,,上市
05610P,上市認購(售)權證,嘉澤國票88售01,,上市
05611P,上市認購(售)權證,元油2X元大87售01,,上市
05612P,上市認購(售)權證,大成鋼元大87售02,,上市
05613P,上市認購(售)權證,大成鋼元大87售03,,上市
05614P,上市認購(售)權證,上銀元大87售03,,上市
05615P,上市認購(售)權證,為升元大87售03,,上市
05616P,上市認購(售)權證,台積電元大87售02,,上市
05617P,上市認購(售)權證,技嘉元大87售02,,上市
05618P,上市認購(售)權證,晶電元大88售03,,上市
05619P,上市認購(售)權證,可成元大87售11,,上市
05620P,上市認購(售)權證,可成元大87售12,,上市
05621P,上市認購(售)權證,華新科元大8A售01,,上市
05622P,上市認購(售)權證,宏達電元大87售03,,上市
05623P,上市認購(售)權證,欣興元大88售01,,上市
05624P,上市認購(售)權證,創意元大88售02,,上市
05625P,上市認購(售)權證,TPK元大88售03,,上市
05626P,上市認購(售)權證,大立光富邦89售04,,上市
05627P,上市認購(售)權證,台積電元富87售02,,上市
05628P,上市認購(售)權證,潤泰全中信89售01,,上市
05629P,上市認購(售)權證,台苯群益87售01,,上市
05630P,上市認購(售)權證,元石油國票89售01,,上市
05631P,上市認購(售)權證,元油2X國票89售01,,上市
05632P,上市認購(售)權證,台積電國票88售01,,上市
05633P,上市認購(售)權證,大同國票87售03,,上市
05634P,上市認購(售)權證,臻鼎國票87售01,,上市
05635P,上市認購(售)權證,矽創國票88售01,,上市
05636P,上市認購(售)權證,臺股指國票87售01,,上市
05637P,上市認購(售)權證,台苯元大87售01,,上市
05638P,上市認購(售)權證,智邦元大87售03,,上市
05639P,上市認購(售)權證,智邦元大87售04,,上市
05640P,上市認購(售)權證,大立光凱基87售03,,上市
05641P,上市認購(售)權證,大立光凱基87售04,,上市
05642P,上市認購(售)權證,大立光凱基87售05,,上市
05643P,上市認購(售)權證,大立光凱基87售06,,上市
05644P,上市認購(售)權證,大立光凱基88售01,,上市
05645P,上市認購(售)權證,大立光凱基88售02,,上市
05646P,上市認購(售)權證,台灣50永豐87售02,,上市
05647P,上市認購(售)權證,晶電永豐87售01,,上市
05648P,上市認購(售)權證,宏達電永豐87售01,,上市
05649P,上市認購(售)權證,智易元富87售01,,上市
05650P,上市認購(售)權證,可成國泰87售02,,上市
05651P,上市認購(售)權證,台積電永昌87售01,,上市
05652P,上市認購(售)權證,大立光永昌87售03,,上市
05653P,上市認購(售)權證,T50反1富邦8B售01,,上市
05654P,上市認購(售)權證,台積電富邦88售01,,上市
05655P,上市認購(售)權證,國巨兆豐88售02,,上市
05656P,上市認購(售)權證,大立光兆豐88售02,,上市
05657P,上市認購(售)權證,利勤凱基88售01,,上市
05658P,上市認購(售)權證,葡萄王元大88售01,,上市
05659P,上市認購(售)權證,聯電元大87售02,,上市
05660P,上市認購(售)權證,台積電元大88售01,,上市
05661P,上市認購(售)權證,台積電元大88售02,,上市
05662P,上市認購(售)權證,台積電元大88售03,,上市
05663P,上市認購(售)權證,佳世達元大88售01,,上市
05664P,上市認購(售)權證,大同元大87售06,,上市
05665P,上市認購(售)權證,大同元大87售07,,上市
05666P,上市認購(售)權證,可成元大87售13,,上市
05667P,上市認購(售)權證,潤泰全元大88售01,,上市
05668P,上市認購(售)權證,欣興元大87售01,,上市
05669P,上市認購(售)權證,隆達元大88售01,,上市
05670P,上市認購(售)權證,台灣50國票89售01,,上市
05671P,上市認購(售)權證,技嘉國票87售01,,上市
05672P,上市認購(售)權證,華新科國票89售01,,上市
05673P,上市認購(售)權證,大立光國票88售01,,上市
05674P,上市認購(售)權證,聯詠國票87售01,,上市
05675P,上市認購(售)權證,智邦統一87售01,,上市
05676P,上市認購(售)權證,滬深2X元富87售04,,上市
05677P,上市認購(售)權證,滬深2X元富87售05,,上市
05678P,上市認購(售)權證,智邦康和87售01,,上市
05679P,上市認購(售)權證,欣興中信87售01,,上市
05680P,上市認購(售)權證,滬深2X群益87售01,,上市
05681P,上市認購(售)權證,滬深2X群益87售02,,上市
05682P,上市認購(售)權證,台積電群益87售01,,上市
05683P,上市認購(售)權證,華新科群益87售01,,上市
05684P,上市認購(售)權證,宏達電國票89售01,,上市
05685P,上市認購(售)權證,卜蜂元大87售01,,上市
05686P,上市認購(售)權證,TPK元大87售01,,上市
05687P,上市認購(售)權證,鎧勝元大87售04,,上市
05688P,上市認購(售)權證,超眾元大87售01,,上市
05689P,上市認購(售)權證,易華電元大87售02,,上市
05690P,上市認購(售)權證,滬深2X統一87售03,,上市
05691P,上市認購(售)權證,易華電元富87售02,,上市
05692P,上市認購(售)權證,勤美康和87售02,,上市
05693P,上市認購(售)權證,漢唐康和87售01,,上市
05694P,上市認購(售)權證,農林康和87售01,,上市
05695P,上市認購(售)權證,強茂國泰87售01,,上市
05696P,上市認購(售)權證,玉晶光國泰88售01,,上市
05697P,上市認購(售)權證,智易國泰87售01,,上市
05698P,上市認購(售)權證,台灣50富邦87售02,,上市
05699P,上市認購(售)權證,旺宏富邦87售03,,上市
05700P,上市認購(售)權證,欣興中信87售02,,上市
05701P,上市認購(售)權證,GIS群益87售03,,上市
05702P,上市認購(售)權證,易華電群益87售02,,上市
05703P,上市認購(售)權證,臻鼎永豐87售01,,上市
05704P,上市認購(售)權證,台郡永豐87售02,,上市
05705P,上市認購(售)權證,滬深2X凱基87售02,,上市
05706P,上市認購(售)權證,微星凱基87售02,,上市
05707P,上市認購(售)權證,聯發科凱基87售03,,上市
05708P,上市認購(售)權證,聯發科凱基87售04,,上市
05709P,上市認購(售)權證,滬深2X國票87售02,,上市
05710P,上市認購(售)權證,南亞科國票87售02,,上市
05711P,上市認購(售)權證,嘉澤國票89售01,,上市
05712P,上市認購(售)權證,台灣50元大87售01,,上市
05713P,上市認購(售)權證,A50正2元大88售02,,上市
05714P,上市認購(售)權證,亞德客元大87售02,,上市
05715P,上市認購(售)權證,鴻海元大87售07,,上市
05716P,上市認購(售)權證,鴻海元大87售08,,上市
05717P,上市認購(售)權證,國巨元大87售01,,上市
05718P,上市認購(售)權證,國巨元大87售02,,上市
05719P,上市認購(售)權證,台積電元大87售05,,上市
05720P,上市認購(售)權證,大同元大87售10,,上市
05721P,上市認購(售)權證,聯發科元大87售04,,上市
05722P,上市認購(售)權證,可成元大87售14,,上市
05723P,上市認購(售)權證,大立光元大87售15,,上市
05724P,上市認購(售)權證,大立光元大87售16,,上市
05725P,上市認購(售)權證,大立光元大87售17,,上市
05726P,上市認購(售)權證,大立光元大87售18,,上市
05727P,上市認購(售)權證,創意元大87售05,,上市
05728P,上市認購(售)權證,瑞儀元大87售02,,上市
05729P,上市認購(售)權證,南電元大87售03,,上市
05730P,上市認購(售)權證,台灣50中信8B售01,,上市
05731P,上市認購(售)權證,滬深2X群益89售01,,上市
05732P,上市認購(售)權證,深中小群益88售01,,上市
05733P,上市認購(售)權證,鴻海群益87售01,,上市
05734P,上市認購(售)權證,大毅群益87售01,,上市
05735P,上市認購(售)權證,大立光群益87售04,,上市
05736P,上市認購(售)權證,大立光群益87售05,,上市
05737P,上市認購(售)權證,國巨國票87售02,,上市
05738P,上市認購(售)權證,義隆國票87售01,,上市
05739P,上市認購(售)權證,台積電兆豐87售02,,上市
05740P,上市認購(售)權證,鴻海凱基87售02,,上市
05741P,上市認購(售)權證,可成凱基87售03,,上市
05742P,上市認購(售)權證,可成凱基87售05,,上市
05743P,上市認購(售)權證,大立光凱基87售10,,上市
05744P,上市認購(售)權證,國巨永豐87售01,,上市
05745P,上市認購(售)權證,國巨統一87售09,,上市
05746P,上市認購(售)權證,儒鴻元富87售01,,上市
05747P,上市認購(售)權證,嘉晶康和87售01,,上市
05748P,上市認購(售)權證,台灣50國泰87售01,,上市
05749P,上市認購(售)權證,鴻海國泰87售01,,上市
05750P,上市認購(售)權證,鴻海國泰87售02,,上市
05751P,上市認購(售)權證,鴻海富邦88售02,,上市
05752P,上市認購(售)權證,儒鴻元大87售06,,上市
05753P,上市認購(售)權證,國巨元大87售04,,上市
05754P,上市認購(售)權證,台積電元大87售08,,上市
05755P,上市認購(售)權證,大立光元大87售19,,上市
05756P,上市認購(售)權證,大立光元大87售20,,上市
05757P,上市認購(售)權證,智原元大88售01,,上市
05758P,上市認購(售)權證,玉晶光元大88售03,,上市
05759P,上市認購(售)權證,創意元大88售03,,上市
05760P,上市認購(售)權證,祥碩元大87售01,,上市
05761P,上市認購(售)權證,嘉聯益元大8A售01,,上市
05762P,上市認購(售)權證,台積電國票87售03,,上市
05763P,上市認購(售)權證,GIS國票88售01,,上市
05764P,上市認購(售)權證,台灣50元大87售02,,上市
05765P,上市認購(售)權證,上銀元大88售01,,上市
05766P,上市認購(售)權證,台積電元大87售09,,上市
05767P,上市認購(售)權證,台積電元大87售10,,上市
05768P,上市認購(售)權證,旺宏元大87售02,,上市
05769P,上市認購(售)權證,美律元大87售05,,上市
05770P,上市認購(售)權證,京元電元大87售01,,上市
05771P,上市認購(售)權證,宏達電元大87售04,,上市
05772P,上市認購(售)權證,大立光元大87售21,,上市
05773P,上市認購(售)權證,大立光元大87售22,,上市
05774P,上市認購(售)權證,欣興元大87售02,,上市
05775P,上市認購(售)權證,國巨兆豐87售05,,上市
05776P,上市認購(售)權證,大立光兆豐87售03,,上市
05777P,上市認購(售)權證,國喬群益87售02,,上市
05778P,上市認購(售)權證,力山群益87售01,,上市
05779P,上市認購(售)權證,致茂群益87售01,,上市
05780P,上市認購(售)權證,微星群益87售01,,上市
05781P,上市認購(售)權證,可成群益87售03,,上市
05782P,上市認購(售)權證,貿聯群益87售01,,上市
05783P,上市認購(售)權證,智邦凱基87售02,,上市
05784P,上市認購(售)權證,欣興凱基87售02,,上市
05785P,上市認購(售)權證,台灣50國泰87售02,,上市
05786P,上市認購(售)權證,亞德客元富87售02,,上市
05787P,上市認購(售)權證,華邦電元富87售02,,上市
05788P,上市認購(售)權證,致茂元富87售02,,上市
05789P,上市認購(售)權證,華新科元富87售02,,上市
05790P,上市認購(售)權證,宏達電元富87售02,,上市
05791P,上市認購(售)權證,聯詠元富87售01,,上市
05792P,上市認購(售)權證,玉晶光元富87售02,,上市
05793P,上市認購(售)權證,創意元富87售02,,上市
05794P,上市認購(售)權證,嘉澤元富87售02,,上市
05795P,上市認購(售)權證,台表科元富87售02,,上市
05796P,上市認購(售)權證,大成鋼中信87售01,,上市
05797P,上市認購(售)權證,台灣50日盛87售01,,上市
05798P,上市認購(售)權證,臺股指日盛87售01,,上市
05799P,上市認購(售)權證,為升群益87售01,,上市
05800P,上市認購(售)權證,台積電群益87售03,,上市
05801P,上市認購(售)權證,大立光群益88售02,,上市
05802P,上市認購(售)權證,玉晶光群益87售02,,上市
05803P,上市認購(售)權證,台達電國票88售01,,上市
05804P,上市認購(售)權證,新光金凱基87售02,,上市
05805P,上市認購(售)權證,上銀兆豐88售01,,上市
05806P,上市認購(售)權證,旺宏元大8A售03,,上市
05807P,上市認購(售)權證,微星元大87售03,,上市
05808P,上市認購(售)權證,瑞昱元大87售02,,上市
05809P,上市認購(售)權證,聯發科元大87售06,,上市
05810P,上市認購(售)權證,大立光元大87售23,,上市
05811P,上市認購(售)權證,大立光元大87售24,,上市
05812P,上市認購(售)權證,亞光元大89售01,,上市
05813P,上市認購(售)權證,GIS元大87售04,,上市
05814P,上市認購(售)權證,臺股指元大87售01,,上市
05815P,上市認購(售)權證,臺股指元大87售04,,上市
05816P,上市認購(售)權證,台積電統一88售09,,上市
05817P,上市認購(售)權證,台積電統一89售04,,上市
05818P,上市認購(售)權證,微星統一87售02,,上市
05819P,上市認購(售)權證,T50反1元富87售03,,上市
05820P,上市認購(售)權證,聯電元富87售01,,上市
05821P,上市認購(售)權證,宏碁元富87售02,,上市
05822P,上市認購(售)權證,美律元富87售02,,上市
05823P,上市認購(售)權證,義隆元富87售02,,上市
05824P,上市認購(售)權證,嘉晶元富87售01,,上市
05825P,上市認購(售)權證,敦泰元富87售02,,上市
05826P,上市認購(售)權證,聚陽中信87售02,,上市
05827P,上市認購(售)權證,大立光日盛87售02,,上市
05828P,上市認購(售)權證,旺宏凱基88售01,,上市
05829P,上市認購(售)權證,聯發科凱基88售01,,上市
05830P,上市認購(售)權證,禾伸堂凱基87售01,,上市
05831P,上市認購(售)權證,聯詠凱基87售03,,上市
05832P,上市認購(售)權證,欣興凱基87售03,,上市
05833P,上市認購(售)權證,滬深2X群益87售06,,上市
05834P,上市認購(售)權證,國喬群益87售03,,上市
05835P,上市認購(售)權證,光磊群益87售01,,上市
05836P,上市認購(售)權證,和碩群益87售01,,上市
05837P,上市認購(售)權證,欣興永豐87售02,,上市
05838P,上市認購(售)權證,聚陽元大87售01,,上市
05839P,上市認購(售)權證,貿聯元大87售02,,上市
05840P,上市認購(售)權證,GIS元大87售05,,上市
05841P,上市認購(售)權證,上銀國票89售01,,上市
05842P,上市認購(售)權證,美律國票89售01,,上市
05843P,上市認購(售)權證,奇力新國票89售01,,上市
05844P,上市認購(售)權證,義隆國票89售01,,上市
05845P,上市認購(售)權證,華新科國票88售02,,上市
05846P,上市認購(售)權證,玉晶光國票89售01,,上市
05847P,上市認購(售)權證,創意國票88售01,,上市
05848P,上市認購(售)權證,嘉澤國票89售02,,上市
05849P,上市認購(售)權證,嘉聯益國票89售01,,上市
05850P,上市認購(售)權證,元油2X元富87售01,,上市
05851P,上市認購(售)權證,大成鋼元富87售02,,上市
05852P,上市認購(售)權證,鴻海元富87售02,,上市
05853P,上市認購(售)權證,國巨元富87售04,,上市
05854P,上市認購(售)權證,台積電元富87售03,,上市
05855P,上市認購(售)權證,南亞科元富87售02,,上市
05856P,上市認購(售)權證,可成元富87售02,,上市
05857P,上市認購(售)權證,可成元富87售04,,上市
05858P,上市認購(售)權證,大立光元富8A售02,,上市
05859P,上市認購(售)權證,超眾元富87售02,,上市
05860P,上市認購(售)權證,元油2X群益87售04,,上市
05861P,上市認購(售)權證,台積電群益87售05,,上市
05862P,上市認購(售)權證,大同群益87售02,,上市
05863P,上市認購(售)權證,大立光群益87售07,,上市
05864P,上市認購(售)權證,南電群益87售01,,上市
05865P,上市認購(售)權證,元油2X國票87售09,,上市
05866P,上市認購(售)權證,上銀永豐87售02,,上市
05867P,上市認購(售)權證,嘉聯益永豐87售02,,上市
05868P,上市認購(售)權證,台積電台新89售01,,上市
05869P,上市認購(售)權證,滬深2X元大87售08,,上市
05870P,上市認購(售)權證,為升元大87售04,,上市
05871P,上市認購(售)權證,國巨元大87售10,,上市
05872P,上市認購(售)權證,國巨元大87售11,,上市
05873P,上市認購(售)權證,智邦元大87售05,,上市
05874P,上市認購(售)權證,義隆元大87售02,,上市
05875P,上市認購(售)權證,華新科元大87售01,,上市
05876P,上市認購(售)權證,嘉晶元大89售04,,上市
05877P,上市認購(售)權證,創意元大88售04,,上市
05878P,上市認購(售)權證,智易元大87售02,,上市
05879P,上市認購(售)權證,台積電統一87售11,,上市
05880P,上市認購(售)權證,全新統一87售02,,上市
05881P,上市認購(售)權證,宏達電統一87售01,,上市
05882P,上市認購(售)權證,臺股指統一89售06,,上市
05883P,上市認購(售)權證,臺股指統一89售07,,上市
05884P,上市認購(售)權證,臺股指統一89售08,,上市
05885P,上市認購(售)權證,臺股指統一89售09,,上市
05886P,上市認購(售)權證,臺股指統一89售10,,上市
05887P,上市認購(售)權證,台達電元富87售02,,上市
05888P,上市認購(售)權證,華新科元富87售04,,上市
05889P,上市認購(售)權證,宏達電元富87售04,,上市
05890P,上市認購(售)權證,玉晶光元富87售04,,上市
05891P,上市認購(售)權證,創意元富87售04,,上市
05892P,上市認購(售)權證,大同群益87售03,,上市
05893P,上市認購(售)權證,京鼎群益87售02,,上市
05894P,上市認購(售)權證,超眾群益87售02,,上市
05895P,上市認購(售)權證,智邦兆豐87售01,,上市
05896P,上市認購(售)權證,聯發科兆豐87售02,,上市
