code,type,name,group,market
035044,上市認購(售)權證,台光電台新87購01,,上市
035045,上市認購(售)權證,智邦統一89購01,,上市
035046,上市認購(售)權證,南亞科統一8A購01,,上市
035047,上市認購(售)權證,高鐵元富87購02,,上市
035048,上市認購(售)權證,高鐵元富87購03,,上市
035049,上市認購(售)權證,亞光元富87購01,,上市
035050,上市認購(售)權證,TPK元富87購01,,上市
035051,上市認購(售)權證,中磊元富87購02,,上市
035052,上市認購(售)權證,聯茂元富87購02,,上市
035053,上市認購(售)權證,百和元富87購01,,上市
035054,上市認購(售)權證,百和元富87購02,,上市
035055,上市認購(售)權證,臺指反元大87購01,,上市
035056,上市認購(售)權證,聚陽元大87購09,,上市
035057,上市認購(售)權證,和大元大87購03,,上市
035058,上市認購(售)權證,和大元大87購04,,上市
035059,上市認購(售)權證,智邦元大87購10,,上市
035060,上市認購(售)權證,全新元大87購02,,上市
035061,上市認購(售)權證,奇力新元大87購02,,上市
035062,上市認購(售)權證,禾伸堂元大87購01,,上市
035063,上市認購(售)權證,欣興元大87購04,,上市
035064,上市認購(售)權證,百和元大87購01,,上市
035065,上市認購(售)權證,百和元大87購02,,上市
035066,上市認購(售)權證,電子類元大8C購02,,上市
035067,上市認購(售)權證,上銀麥證87購01,,上市
035068,上市認購(售)權證,華通麥證87購01,,上市
035069,上市認購(售)權證,國巨富邦87購07,,上市
035070,上市認購(售)權證,智邦富邦87購02,,上市
035071,上市認購(售)權證,華新科富邦88購02,,上市
035072,上市認購(售)權證,台郡富邦87購02,,上市
035073,上市認購(售)權證,GIS富邦87購02,,上市
035074,上市認購(售)權證,技嘉群益87購01,,上市
035075,上市認購(售)權證,富邦金群益87購01,,上市
035076,上市認購(售)權證,TPK群益87購04,,上市
035077,上市認購(售)權證,富邦金日盛87購01,,上市
035078,上市認購(售)權證,國巨凱基88購02,,上市
035079,上市認購(售)權證,華邦電凱基87購01,,上市
035080,上市認購(售)權證,建準凱基88購01,,上市
035081,上市認購(售)權證,大立光凱基88購04,,上市
035082,上市認購(售)權證,大立光凱基88購05,,上市
035083,上市認購(售)權證,大立光凱基88購06,,上市
035084,上市認購(售)權證,亞德客中信89購01,,上市
035085,上市認購(售)權證,亞光中信89購02,,上市
035086,上市認購(售)權證,華邦電麥證87購01,,上市
035087,上市認購(售)權證,聯發科麥證87購03,,上市
035088,上市認購(售)權證,元大金麥證88購01,,上市
035089,上市認購(售)權證,上銀統一8A購01,,上市
03508P,上市認購(售)權證,華新科國泰84售04,,上市
035090,上市認購(售)權證,智易統一89購02,,上市
035091,上市認購(售)權證,台積電元富87購05,,上市
035092,上市認購(售)權證,微星元富87購02,,上市
035093,上市認購(售)權證,揚明光元富88購01,,上市
035094,上市認購(售)權證,瑞儀元富87購01,,上市
035095,上市認購(售)權證,國巨國票87購03,,上市
035096,上市認購(售)權證,台積電國票87購05,,上市
035097,上市認購(售)權證,大同國票87購04,,上市
035098,上市認購(售)權證,美律國票88購02,,上市
035099,上市認購(售)權證,嘉澤國票87購03,,上市
03509P,上市認購(售)權證,華新科國泰84售05,,上市
035100,上市認購(售)權證,臻鼎國票88購02,,上市
035101,上市認購(售)權證,台郡國票87購03,,上市
035102,上市認購(售)權證,光寶科永豐87購01,,上市
035103,上市認購(售)權證,台積電永豐87購02,,上市
035104,上市認購(售)權證,聯強永豐87購02,,上市
035105,上市認購(售)權證,宏碁永豐87購01,,上市
035106,上市認購(售)權證,揚明光永豐87購03,,上市
035107,上市認購(售)權證,大成鋼元大87購06,,上市
035108,上市認購(售)權證,華通元大89購03,,上市
035109,上市認購(售)權證,鴻海元大87購13,,上市
03510P,上市認購(售)權證,華新科國泰85售06,,上市
035110,上市認購(售)權證,微星元大87購05,,上市
035111,上市認購(售)權證,聯發科元大87購10,,上市
035112,上市認購(售)權證,華新科元大88購01,,上市
035113,上市認購(售)權證,富邦金元大87購03,,上市
035114,上市認購(售)權證,新光金元大87購03,,上市
035115,上市認購(售)權證,大立光元大87購31,,上市
035116,上市認購(售)權證,大立光元大87購32,,上市
035117,上市認購(售)權證,大立光元大87購33,,上市
035118,上市認購(售)權證,大立光元大88購03,,上市
035119,上市認購(售)權證,創意元大87購06,,上市
035120,上市認購(售)權證,鎧勝元大87購05,,上市
035121,上市認購(售)權證,祥碩元大87購04,,上市
035122,上市認購(售)權證,祥碩元大87購05,,上市
035123,上市認購(售)權證,盛群元大87購01,,上市
035124,上市認購(售)權證,聯茂元大87購02,,上市
035125,上市認購(售)權證,GIS元大87購06,,上市
035126,上市認購(售)權證,易華電元大87購04,,上市
035127,上市認購(售)權證,鴻海永昌87購01,,上市
035128,上市認購(售)權證,鴻海永昌87購02,,上市
035129,上市認購(售)權證,上銀兆豐88購02,,上市
035130,上市認購(售)權證,智原兆豐87購01,,上市
035131,上市認購(售)權證,滬深2X群益87購07,,上市
035132,上市認購(售)權證,燿華群益89購01,,上市
035133,上市認購(售)權證,智伸科群益87購02,,上市
035134,上市認購(售)權證,訊芯群益87購02,,上市
035135,上市認購(售)權證,上銀日盛87購01,,上市
035136,上市認購(售)權證,遠東新麥證87購01,,上市
035137,上市認購(售)權證,嘉晶中信89購01,,上市
035138,上市認購(售)權證,滬深2X凱基87購06,,上市
035139,上市認購(售)權證,滬深2X凱基87購07,,上市
035140,上市認購(售)權證,S&P反1凱基88購01,,上市
035141,上市認購(售)權證,上銀凱基87購03,,上市
035142,上市認購(售)權證,台積電凱基89購01,,上市
035143,上市認購(售)權證,台積電凱基89購02,,上市
035144,上市認購(售)權證,奇力新凱基87購05,,上市
035145,上市認購(售)權證,奇力新凱基87購06,,上市
035146,上市認購(售)權證,貿聯凱基8A購02,,上市
035147,上市認購(售)權證,啟碁凱基87購01,,上市
035148,上市認購(售)權證,滬深2X永豐87購01,,上市
035149,上市認購(售)權證,滬深2X永豐87購02,,上市
035150,上市認購(售)權證,滬深2X永豐87購03,,上市
035151,上市認購(售)權證,瑞昱永豐87購03,,上市
035152,上市認購(售)權證,廣達永豐87購01,,上市
035153,上市認購(售)權證,台光電永豐87購01,,上市
035154,上市認購(售)權證,美律永豐87購03,,上市
035155,上市認購(售)權證,祥碩永豐87購02,,上市
035156,上市認購(售)權證,臺指反元大87購02,,上市
035157,上市認購(售)權證,華夏元大87購02,,上市
035158,上市認購(售)權證,中橡元大87購02,,上市
035159,上市認購(售)權證,國巨元大87購18,,上市
035160,上市認購(售)權證,台積電元大87購21,,上市
035161,上市認購(售)權證,台積電元大87購22,,上市
035162,上市認購(售)權證,旺宏元大89購04,,上市
035163,上市認購(售)權證,大同元大87購12,,上市
035164,上市認購(售)權證,大同元大87購13,,上市
035165,上市認購(售)權證,微星元大87購06,,上市
035166,上市認購(售)權證,微星元大87購07,,上市
035167,上市認購(售)權證,瑞昱元大87購04,,上市
035168,上市認購(售)權證,南亞科元大87購03,,上市
035169,上市認購(售)權證,聯發科元大87購11,,上市
035170,上市認購(售)權證,聯發科元大87購12,,上市
035171,上市認購(售)權證,奇力新元大8A購02,,上市
035172,上市認購(售)權證,創意元大88購05,,上市
035173,上市認購(售)權證,臻鼎元大87購04,,上市
035174,上市認購(售)權證,中磊元大87購03,,上市
035175,上市認購(售)權證,嘉聯益元大89購02,,上市
035176,上市認購(售)權證,超眾元大87購06,,上市
035177,上市認購(售)權證,大成鋼統一89購01,,上市
035178,上市認購(售)權證,上銀統一8A購02,,上市
035179,上市認購(售)權證,中橡統一87購01,,上市
035180,上市認購(售)權證,台光電統一88購01,,上市
035181,上市認購(售)權證,大立光統一87購05,,上市
035182,上市認購(售)權證,T50反1元富87購08,,上市
035183,上市認購(售)權證,微星元富87購03,,上市
035184,上市認購(售)權證,晶電元富87購01,,上市
035185,上市認購(售)權證,可成元富87購07,,上市
035186,上市認購(售)權證,可成元富87購08,,上市
035187,上市認購(售)權證,聯發科國泰89購01,,上市
035188,上市認購(售)權證,亞德客富邦87購01,,上市
035189,上市認購(售)權證,世紀鋼富邦87購01,,上市
035190,上市認購(售)權證,聚陽兆豐87購01,,上市
035191,上市認購(售)權證,上銀兆豐88購03,,上市
035192,上市認購(售)權證,滬深2X第一87購01,,上市
035193,上市認購(售)權證,東聯永豐87購01,,上市
035194,上市認購(售)權證,京元電永豐87購01,,上市
035195,上市認購(售)權證,貿聯永豐87購01,,上市
035196,上市認購(售)權證,道瓊指國票88購01,,上市
035197,上市認購(售)權證,道瓊反國票87購01,,上市
035198,上市認購(售)權證,欣興群益89購01,,上市
035199,上市認購(售)權證,健鼎群益87購01,,上市
035200,上市認購(售)權證,元黃金國泰88購01,,上市
035201,上市認購(售)權證,中石化國泰88購01,,上市
035202,上市認購(售)權證,儒鴻國泰87購01,,上市
035203,上市認購(售)權證,為升國泰89購01,,上市
035204,上市認購(售)權證,微星國泰89購01,,上市
035205,上市認購(售)權證,亞光國泰89購01,,上市
035206,上市認購(售)權證,智易國泰88購01,,上市
035207,上市認購(售)權證,統一麥證88購01,,上市
035208,上市認購(售)權證,富邦金麥證88購01,,上市
035209,上市認購(售)權證,新光金麥證88購01,,上市
035210,上市認購(售)權證,寶滬深元大87購01,,上市
035211,上市認購(售)權證,大成鋼元大87購07,,上市
035212,上市認購(售)權證,鴻海元大87購14,,上市
035213,上市認購(售)權證,鴻海元大88購02,,上市
035214,上市認購(售)權證,國巨元大87購19,,上市
035215,上市認購(售)權證,台積電元大87購23,,上市
035216,上市認購(售)權證,南亞科元大87購04,,上市
035217,上市認購(售)權證,京元電元大87購02,,上市
035218,上市認購(售)權證,聯發科元大88購01,,上市
035219,上市認購(售)權證,聯發科元大88購02,,上市
035220,上市認購(售)權證,富邦金元大87購04,,上市
035221,上市認購(售)權證,大立光元大87購35,,上市
035222,上市認購(售)權證,大立光元大87購36,,上市
035223,上市認購(售)權證,大立光元大88購04,,上市
035224,上市認購(售)權證,智易元大88購01,,上市
035225,上市認購(售)權證,TPK元大87購03,,上市
035226,上市認購(售)權證,道瓊指凱基88購01,,上市
035227,上市認購(售)權證,FBVIX凱基87購01,,上市
035228,上市認購(售)權證,台達電凱基87購03,,上市
035229,上市認購(售)權證,高鐵凱基8A購01,,上市
03522P,上市認購(售)權證,台積電群益84售01,,上市
035230,上市認購(售)權證,揚明光凱基8A購01,,上市
035231,上市認購(售)權證,敦南凱基87購01,,上市
035232,上市認購(售)權證,盛群凱基87購01,,上市
035233,上市認購(售)權證,台表科凱基87購01,,上市
035234,上市認購(售)權證,巨大凱基87購01,,上市
035235,上市認購(售)權證,新光金統一87購02,,上市
035236,上市認購(售)權證,大立光統一89購03,,上市
035237,上市認購(售)權證,和大元富87購01,,上市
035238,上市認購(售)權證,為升元富87購01,,上市
035239,上市認購(售)權證,康普元富87購01,,上市
035240,上市認購(售)權證,上銀中信88購01,,上市
035241,上市認購(售)權證,美律中信87購01,,上市
035242,上市認購(售)權證,晶電中信89購02,,上市
035243,上市認購(售)權證,大立光中信87購02,,上市
035244,上市認購(售)權證,嘉聯益中信89購01,,上市
035245,上市認購(售)權證,元上證群益87購01,,上市
035246,上市認購(售)權證,滬深2X群益87購08,,上市
035247,上市認購(售)權證,滬深2X群益87購09,,上市
035248,上市認購(售)權證,道瓊指群益87購01,,上市
035249,上市認購(售)權證,道瓊指群益87購02,,上市
035250,上市認購(售)權證,國巨群益87購04,,上市
035251,上市認購(售)權證,台光電群益87購01,,上市
035252,上市認購(售)權證,台表科群益88購03,,上市
035253,上市認購(售)權證,台虹群益87購01,,上市
035254,上市認購(售)權證,聯電麥證87購03,,上市
035255,上市認購(售)權證,創意麥證87購01,,上市
035256,上市認購(售)權證,道瓊反永豐87購01,,上市
035257,上市認購(售)權證,FBVIX永豐87購01,,上市
035258,上市認購(售)權證,華通永豐87購02,,上市
035259,上市認購(售)權證,嘉晶永豐87購02,,上市
035260,上市認購(售)權證,日電貿永豐87購03,,上市
035261,上市認購(售)權證,易華電永豐87購02,,上市
035262,上市認購(售)權證,台積電日盛87購04,,上市
035263,上市認購(售)權證,道瓊指凱基87購02,,上市
035264,上市認購(售)權證,國巨凱基87購07,,上市
035265,上市認購(售)權證,國巨凱基87購08,,上市
035266,上市認購(售)權證,國巨凱基89購01,,上市
035267,上市認購(售)權證,光磊凱基8A購02,,上市
035268,上市認購(售)權證,華航凱基8A購01,,上市
035269,上市認購(售)權證,聯詠凱基88購01,,上市
035270,上市認購(售)權證,欣興凱基87購04,,上市
035271,上市認購(售)權證,麗豐凱基87購02,,上市
035272,上市認購(售)權證,中磊凱基87購01,,上市
035273,上市認購(售)權證,矽創凱基87購01,,上市
035274,上市認購(售)權證,華新台新97購01,,上市
035275,上市認購(售)權證,台積電台新97購01,,上市
035276,上市認購(售)權證,南亞科台新97購01,,上市
035277,上市認購(售)權證,景碩台新97購01,,上市
035278,上市認購(售)權證,台表科康和87購02,,上市
035279,上市認購(售)權證,華通統一89購02,,上市
035280,上市認購(售)權證,旺宏元富87購02,,上市
035281,上市認購(售)權證,欣興元富87購03,,上市
035282,上市認購(售)權證,亞德客國票87購02,,上市
035283,上市認購(售)權證,滬深2X兆豐87購02,,上市
035284,上市認購(售)權證,滬深2X元大87購12,,上市
035285,上市認購(售)權證,上銀元大87購06,,上市
035286,上市認購(售)權證,台光電元大87購02,,上市
035287,上市認購(售)權證,美律元大87購06,,上市
035288,上市認購(售)權證,華新科元大88購02,,上市
035289,上市認購(售)權證,宏達電元大88購04,,上市
035290,上市認購(售)權證,大立光元大87購37,,上市
035291,上市認購(售)權證,大立光元大87購38,,上市
035292,上市認購(售)權證,大立光元大88購05,,上市
035293,上市認購(售)權證,亞光元大88購01,,上市
035294,上市認購(售)權證,欣興元大87購05,,上市
035295,上市認購(售)權證,嘉澤元大88購02,,上市
035296,上市認購(售)權證,聯茂元大87購03,,上市
035297,上市認購(售)權證,台郡元大88購02,,上市
035298,上市認購(售)權證,台表科元大87購01,,上市
035299,上市認購(售)權證,道瓊指國泰87購01,,上市
035300,上市認購(售)權證,南亞科國泰89購01,,上市
035301,上市認購(售)權證,欣興國泰88購01,,上市
035302,上市認購(售)權證,玉晶光國泰88購02,,上市
035303,上市認購(售)權證,貿聯國泰88購01,,上市
035304,上市認購(售)權證,台表科國泰88購01,,上市
035305,上市認購(售)權證,全新富邦87購02,,上市
035306,上市認購(售)權證,欣興富邦87購01,,上市
035307,上市認購(售)權證,玉晶光富邦89購01,,上市
035308,上市認購(售)權證,GIS富邦87購03,,上市
035309,上市認購(售)權證,上銀永豐87購03,,上市
035310,上市認購(售)權證,義隆永豐87購01,,上市
035311,上市認購(售)權證,大立光永豐87購06,,上市
035312,上市認購(售)權證,台表科永豐87購03,,上市
035313,上市認購(售)權證,為升群益87購02,,上市
035314,上市認購(售)權證,宏碁群益87購01,,上市
035315,上市認購(售)權證,致茂群益87購02,,上市
035316,上市認購(售)權證,敦泰群益87購01,,上市
035317,上市認購(售)權證,矽力群益87購02,,上市
035318,上市認購(售)權證,GIS群益88購02,,上市
035319,上市認購(售)權證,祥碩中信87購01,,上市
035320,上市認購(售)權證,鎧勝康和87購01,,上市
035321,上市認購(售)權證,光寶科元富87購01,,上市
035322,上市認購(售)權證,台光電元富87購02,,上市
035323,上市認購(售)權證,京元電元富87購01,,上市
035324,上市認購(售)權證,T50反1國票88購02,,上市
035325,上市認購(售)權證,力山國票88購01,,上市
035326,上市認購(售)權證,華通國票88購03,,上市
035327,上市認購(售)權證,美律國票88購03,,上市
035328,上市認購(售)權證,欣興國票88購02,,上市
035329,上市認購(售)權證,創意國票88購03,,上市
035330,上市認購(售)權證,祥碩國票87購01,,上市
035331,上市認購(售)權證,元大金日盛87購02,,上市
035332,上市認購(售)權證,TPK日盛88購01,,上市
035333,上市認購(售)權證,台泥凱基87購02,,上市
035334,上市認購(售)權證,亞泥凱基87購02,,上市
035335,上市認購(售)權證,儒鴻凱基87購01,,上市
035336,上市認購(售)權證,儒鴻凱基87購02,,上市
035337,上市認購(售)權證,為升凱基87購05,,上市
035338,上市認購(售)權證,國巨凱基87購09,,上市
035339,上市認購(售)權證,廣宇凱基87購02,,上市
035340,上市認購(售)權證,智邦凱基87購04,,上市
035341,上市認購(售)權證,英業達凱基87購01,,上市
035342,上市認購(售)權證,致茂凱基87購02,,上市
035343,上市認購(售)權證,大同凱基87購05,,上市
035344,上市認購(售)權證,大同凱基87購06,,上市
035345,上市認購(售)權證,技嘉凱基87購02,,上市
035346,上市認購(售)權證,大立光凱基87購18,,上市
035347,上市認購(售)權證,禾伸堂凱基88購01,,上市
035348,上市認購(售)權證,創意凱基87購03,,上市
035349,上市認購(售)權證,敦泰凱基87購01,,上市
035350,上市認購(售)權證,鎧勝凱基87購04,,上市
035351,上市認購(售)權證,台郡凱基87購06,,上市
035352,上市認購(售)權證,T50反1元大87購05,,上市
035353,上市認購(售)權證,T50反1元大87購06,,上市
035354,上市認購(售)權證,國巨元大87購20,,上市
035355,上市認購(售)權證,台積電元大87購26,,上市
035356,上市認購(售)權證,台積電元大87購27,,上市
035357,上市認購(售)權證,大同元大87購14,,上市
035358,上市認購(售)權證,廣達元大87購01,,上市
035359,上市認購(售)權證,奇力新元大8A購03,,上市
035360,上市認購(售)權證,景碩元大87購01,,上市
035361,上市認購(售)權證,玉晶光元大8A購01,,上市
035362,上市認購(售)權證,貿聯元大89購01,,上市
035363,上市認購(售)權證,臻鼎元大87購05,,上市
035364,上市認購(售)權證,祥碩元大87購06,,上市
035365,上市認購(售)權證,祥碩元大88購01,,上市
035366,上市認購(售)權證,易華電元大87購05,,上市
035367,上市認購(售)權證,祥碩國泰89購01,,上市
035368,上市認購(售)權證,啟碁國泰88購01,,上市
035369,上市認購(售)權證,中華電富邦88購01,,上市
035370,上市認購(售)權證,宏達電富邦88購01,,上市
035371,上市認購(售)權證,旺宏兆豐88購01,,上市
035372,上市認購(售)權證,力山永豐87購03,,上市
035373,上市認購(售)權證,國巨永豐87購05,,上市
035374,上市認購(售)權證,健策永豐87購01,,上市
035375,上市認購(售)權證,祥碩永豐87購04,,上市
035376,上市認購(售)權證,敦南永豐87購01,,上市
035377,上市認購(售)權證,同欣電永豐87購01,,上市
035378,上市認購(售)權證,力山國泰89購01,,上市
035379,上市認購(售)權證,京元電國泰88購01,,上市
035380,上市認購(售)權證,百和國泰89購01,,上市
035381,上市認購(售)權證,智原永昌87購01,,上市
035382,上市認購(售)權證,T50反1永昌8A購01,,上市
035383,上市認購(售)權證,滬深2X永昌88購01,,上市
035384,上市認購(售)權證,台達電永昌88購01,,上市
035385,上市認購(售)權證,強茂永昌88購01,,上市
035386,上市認購(售)權證,元大金永昌88購01,,上市
035387,上市認購(售)權證,祥碩永昌88購01,,上市
035388,上市認購(售)權證,義隆元富87購03,,上市
035389,上市認購(售)權證,易華電元富87購03,,上市
035390,上市認購(售)權證,滬深2X群益88購01,,上市
035391,上市認購(售)權證,滬深2X群益8A購01,,上市
035392,上市認購(售)權證,台苯群益88購01,,上市
035393,上市認購(售)權證,新光鋼群益87購01,,上市
035394,上市認購(售)權證,鴻海群益87購03,,上市
035395,上市認購(售)權證,鴻海群益88購01,,上市
035396,上市認購(售)權證,建準群益87購01,,上市
035397,上市認購(售)權證,緯創群益87購01,,上市
035398,上市認購(售)權證,祥碩群益88購01,,上市
035399,上市認購(售)權證,達運群益87購01,,上市
035400,上市認購(售)權證,台郡群益87購02,,上市
035401,上市認購(售)權證,台虹群益87購02,,上市
035402,上市認購(售)權證,滬深2X元大87購13,,上市
035403,上市認購(售)權證,滬深2X元大87購14,,上市
035404,上市認購(售)權證,道瓊指元大87購02,,上市
035405,上市認購(售)權證,道瓊指元大87購03,,上市
035406,上市認購(售)權證,上銀元大88購03,,上市
035407,上市認購(售)權證,國巨元大87購21,,上市
035408,上市認購(售)權證,臺企銀元大87購01,,上市
035409,上市認購(售)權證,亞光元大88購02,,上市
035410,上市認購(售)權證,欣興元大88購02,,上市
035411,上市認購(售)權證,嘉澤元大88購03,,上市
035412,上市認購(售)權證,易華電元大88購02,,上市
035413,上市認購(售)權證,世紀鋼元大8A購01,,上市
035414,上市認購(售)權證,臺企銀日盛87購01,,上市
035415,上市認購(售)權證,台苯凱基87購02,,上市
035416,上市認購(售)權證,為升凱基87購06,,上市
035417,上市認購(售)權證,國巨凱基8A購01,,上市
035418,上市認購(售)權證,燿華凱基87購03,,上市
035419,上市認購(售)權證,華新科凱基87購02,,上市
035420,上市認購(售)權證,亞光凱基87購01,,上市
035421,上市認購(售)權證,亞光凱基87購02,,上市
035422,上市認購(售)權證,禾伸堂凱基87購08,,上市
035423,上市認購(售)權證,隆達凱基87購02,,上市
035424,上市認購(售)權證,祥碩凱基8A購03,,上市
035425,上市認購(售)權證,祥碩凱基8A購04,,上市
035426,上市認購(售)權證,瀚宇博凱基87購01,,上市
035427,上市認購(售)權證,同欣電凱基87購02,,上市
035428,上市認購(售)權證,台表科凱基87購02,,上市
035429,上市認購(售)權證,訊芯凱基87購02,,上市
035430,上市認購(售)權證,世紀鋼凱基8A購01,,上市
035431,上市認購(售)權證,康控第一88購01,,上市
035432,上市認購(售)權證,鴻海群益88購02,,上市
035433,上市認購(售)權證,宏碁群益88購01,,上市
035434,上市認購(售)權證,晶電群益88購01,,上市
035435,上市認購(售)權證,祥碩群益88購02,,上市
035436,上市認購(售)權證,彩晶群益8A購01,,上市
035437,上市認購(售)權證,順德永豐88購01,,上市
035438,上市認購(售)權證,英業達永豐88購01,,上市
035439,上市認購(售)權證,南亞科永豐88購01,,上市
035440,上市認購(售)權證,奇力新永豐88購01,,上市
035441,上市認購(售)權證,盟立永豐88購01,,上市
035442,上市認購(售)權證,京鼎永豐88購01,,上市
035443,上市認購(售)權證,創意永豐88購01,,上市
035444,上市認購(售)權證,麗豐永豐88購01,,上市
035445,上市認購(售)權證,康控永豐88購02,,上市
035446,上市認購(售)權證,康控永豐88購03,,上市
035447,上市認購(售)權證,康控永豐88購04,,上市
035448,上市認購(售)權證,達方永豐88購01,,上市
035449,上市認購(售)權證,國巨日盛88購01,,上市
035450,上市認購(售)權證,大立光日盛88購01,,上市
035451,上市認購(售)權證,台灣50凱基8B購03,,上市
035452,上市認購(售)權證,統一凱基88購01,,上市
035453,上市認購(售)權證,中石化凱基88購01,,上市
035454,上市認購(售)權證,亞德客凱基88購01,,上市
035455,上市認購(售)權證,國巨凱基88購05,,上市
035456,上市認購(售)權證,華邦電凱基88購01,,上市
035457,上市認購(售)權證,華邦電凱基89購01,,上市
035458,上市認購(售)權證,智邦凱基88購01,,上市
035459,上市認購(售)權證,全新凱基8A購01,,上市
035460,上市認購(售)權證,宏達電凱基89購01,,上市
035461,上市認購(售)權證,日月光凱基88購01,,上市
035462,上市認購(售)權證,康控凱基88購01,,上市
035463,上市認購(售)權證,康控凱基88購02,,上市
035464,上市認購(售)權證,GIS凱基8A購01,,上市
035465,上市認購(售)權證,南茂凱基88購01,,上市
035466,上市認購(售)權證,上銀元大88購04,,上市
035467,上市認購(售)權證,聯電元大88購01,,上市
035468,上市認購(售)權證,華通元大89購04,,上市
035469,上市認購(售)權證,國巨元大88購01,,上市
03546C,上市認購(售)權證,金融類元大84牛01,,上市
03546P,上市認購(售)權證,華邦電元大84售03,,上市
